{
  "schema_version": "1.0.0",
  "state_id": "dst_01J8ZB4M7XQK2N5R9T3V6W8YCA",
  "decision_id": "dec_01J8Z4K7M2QF9X3B7T5V0N6RCD",
  "consumer_id": "jarvis",
  "consumer_version": "0.3.2",
  "status": "surfaced",
  "status_at": "2026-07-29T14:30:00Z",
  "actor": { "type": "system", "id": "brief_assembler" },
  "metadata": { "brief_id": "brf_2026_07_29_morning", "position": 2 },
  "created_at": "2026-07-29T14:30:00Z"
}
